id,date,title
,2019-11-03,Why Bears Continue To Get Apple Wrong
,2019-10-29,Apple: 3 Key Earnings Questions
,2019-10-25,How Much Are Apple Inc. (NASDAQ:AAPL) Insiders Taking Off ...
,2019-11-07,Apple Inc. (AAPL) Closes 1.15% Up on the Day for November 07
,2019-10-21,Apple Edges Higher After Raymond James Boosts Price Target
,2019-11-05,Apple Inc. [AAPL] – A worthy stock for long-term investors
,2019-11-07,Investor Insight: Apple Inc. [AAPL] Goes Ballistic – Investor ...
,2019-10-25,Buy Apple (AAPL) Stock at New Highs Ahead of Earnings on ...
,2019-10-23,"Morgan Stanley: Apple TV+ could be $9B business, 5G ..."
,2019-10-28,Apple Inc. (NASDAQ:AAPL) earnings are on tap Wednesday ...
